speech_id,file,year,sentence,negative,positive,sum positive/negative
speech_00046,parnell_source_00203,1876,He was astonished that the Admiralty had made no effort to clear themselves from the charge of selling stores which were no longer fit for food.,0.128,0.289,0.417
speech_00046,parnell_source_00207,1876,He was astonished that the Admiralty had made no effort to clear themselves from the charge of selling stores which were no longer fit for food.,0.128,0.289,0.417
"speech_00049, speech_00050, speech_00051",parnell_source_00240,1886,Mr. O'Kelly kept his talents unobtrusive in the background.,0,0.417,0.417
speech_00076,parnell_source_00326,1886,these gentlemen are afraid of hearing the truth.,0.194,0.223,0.417
speech_00077,parnell_source_00327,1886,"It would be the verist cowardice for the great British people, with dominions upon which the sun never sets, to fear to do justice to a small people few in number like the Irish merely on account of this ridiculous cry.",0.163,0.254,0.417
speech_00073,parnell_source_00331,1885,"It was stolen from Ireland and must be restored; and that must include the restitution of Grattan's Parliament, with its important privileges and far reaching constitution.",0.093,0.324,0.417
speech_00052,parnell_source_00274,1886,"When you are proposing a great settlement which can only succeed if freely accepted by public opinion in Ireland, is it worth while for a rich country like England on the question of £1,000,000, one way or the other to drive too hard a bargain?",0.025,0.391,0.416
speech_00072,parnell_source_00305,1880,The mention of the Herald elicited a perfect storm of hisses which interrupted the speaker for an appreciable space of time.,0.19,0.226,0.416
speech_00077,parnell_source_00327,1886,What harm could poor little Ireland do to great and rich England if you were to concede her ten times as much as this?,0.192,0.224,0.416
speech_00025,parnell_source_00098,1875,But how mistaken they had been!,0.415,0,0.415
speech_00025,parnell_source_00099,1875,But how mistaken they had been!,0.415,0,0.415
"speech_00049, speech_00050",parnell_source_00252,1886,"Captain O'Shea voted for him on a critical occasion, and he could never forget so great a service.",0.104,0.311,0.415
speech_00050,parnell_source_00262,1886,"Mr. Parnell, therefore, implored the electors to defeat this ""dirty trick.""",0.415,0,0.415
speech_00052,parnell_source_00269,1886,Englishmen loves a man who fights his own corner to the end.,0.175,0.24,0.415
speech_00076,parnell_source_00326,1886,"It has been a fortunate and a happy thing for my country that this question has fallen into the hands of that great man, that greatest man,  in whom we recognize the ability and the willingness to settle this question.",0.047,0.366,0.413
speech_00025,parnell_source_00097,1875,Nobody ever doubted that.,0.412,0,0.412
speech_00028,parnell_source_00104,1875,"Chairman   Name them, if you have no objection.",0.412,0,0.412
speech_00028,parnell_source_00106,1875,"Chairman   Name them, if you have no objection.",0.412,0,0.412
speech_00050,parnell_source_00262,1886,He expressed a similar regret yesterday.,0.412,0,0.412
speech_00053,parnell_source_00282,1886,"You have fined the innocent for offences committed by the guilty; you have taken power to expel aliens from this country; you have revived the Curfew Law and the blood money of your Norman conquerors; you have gagged the Press and seized and suppressed newspapers; you have manufactured now crimes and offences, and applied fresh penalties unknown to your laws for these crimes and offences.",0.333,0.079,0.412
speech_00053,parnell_source_00283,1886,"He chose a system that was not a fair one, but the one that would show best for his argument.",0.185,0.227,0.412
speech_00058,parnell_source_00288,1880,I think it was an ill advised and ill judged Question.,0.412,0,0.412
speech_00062,parnell_source_00292,1880,What happened after the Irish Famine?,0.412,0,0.412
speech_00072,parnell_source_00306,1880,"Our Irish famines are not famines of food, they are famines of means with which to buy food.",0.412,0,0.412
speech_00076,parnell_source_00326,1886,I know these gentry well.,0,0.412,0.412
speech_00077,parnell_source_00327,1886,"Well, I do not know.",0,0.412,0.412
speech_00082,parnell_source_00336,1880,I am glad to say that I have received a cheering telegram from Ireland.,0,0.412,0.412
speech_00086,parnell_source_00340,1880,It is useless to give charity unless you take some steps to put down the tyranny.,0.285,0.127,0.412
speech_00053,parnell_source_00282,1886,I entirely agree upon this point.,0,0.411,0.411
speech_00053,parnell_source_00303,1886,I entirely agree upon this point.,0,0.411,0.411
speech_00085,parnell_source_00339,1880,"Second, to help to break down the terrible system which was the cause of all this distress.",0.298,0.113,0.411
speech_00025,parnell_source_00097,1875,This resolution embraced some very important matters.,0,0.41,0.41
speech_00053,parnell_source_00283,1886,The right hon. gentleman's comparison of THE GREAT WEALTH OF ULSTER WITH THE OTHER PROVINCES has been taken up by the Loyal and Patriotic Unions throughout the country as a sort of war cry.,0.16,0.25,0.41
speech_00070,parnell_source_00300,1880,"The tenantry of Ireland were able to win this battle without inflicting injury upon animals or upon their landlords, and he was convinced that they would win in the long run.",0.071,0.339,0.41
speech_00053,parnell_source_00302,1886,"During the last five or six years we thoroughly differ from him, and he has returned the compliment by using every opportunity to condemn us, so that the honours are pretty easy .",0.059,0.351,0.41
speech_00072,parnell_source_00306,1880,Now let us consider THE CAUSES OF THE IRISH FAMINE And distress there.,0.41,0,0.41
speech_00089,parnell_source_00344,1880,"No grander undertaking could be entered into, he said, than that of relieving the misery of the people in Ireland.",0.218,0.192,0.41
speech_00073,parnell_source_00330,1885,Thousands of people lined the streets and greeted the hon. gentleman with a cordial welcome.,0,0.409,0.409
speech_00053,parnell_source_00303,1886,"You have fined the innocent for offences committed by the guilty; you have taken power to expel aliens from this country; you have revived the Curfew Law and the blood money of your Norman conquerors; you have gagged the Press and seized and suppressed newspapers; you have manufactured new crimes and offences, and applied fresh penalties unknown to your laws for these crimes and offense.",0.329,0.079,0.408
speech_00074,parnell_source_00324,1885,"However, they were not satisfied with the Coercion Act.",0.408,0,0.408
speech_00052,parnell_source_00266,1886,"Every violent speech, every criminal action, will be so many nails driven into the coffin of their Constitution.",0.407,0,0.407
speech_00052,parnell_source_00267,1886,"Every violent speech, every criminal action will be so many nails driven into the coffin of that constitution.",0.407,0,0.407
speech_00052,parnell_source_00269,1886,"He faced every danger and risk, both personal and otherwise.",0.407,0,0.407
speech_00052,parnell_source_00269,1886,"Every violent speech, every criminal action, will be so many nails driven in the coffin of that constitution.",0.407,0,0.407
speech_00052,parnell_source_00271,1886,"Every violent speech, every criminal action, will be so many nails driven in the coffin of that constitution.",0.407,0,0.407
speech_00052,parnell_source_00272,1886,"Every violent speech, every criminal action, will be so many nails driven in the coffin of that constitution.",0.407,0,0.407
speech_00052,parnell_source_00274,1886,"Every violent speech, every criminal action, will be so many nails driven into the coffin of their Constitution.",0.407,0,0.407
speech_00052,parnell_source_00278,1886,"He faced every danger, every risk, both physical and otherwise.",0.407,0,0.407
speech_00052,parnell_source_00278,1886,"Every violent speech, every criminal action, would be so many nails driven into the coffin of that Constitution.",0.407,0,0.407
speech_00052,parnell_source_00281,1886,"Every violent speech, every criminal action will be so many nails driven into the coffin of that Constitution.",0.407,0,0.407
speech_00059,parnell_source_00289,1880,They were deliberately encouraging outrage and revolution if the Government of the Queen showed itself insensible to the sufferings of multitudes.,0.289,0.118,0.407
speech_00069,parnell_source_00299,1880,There was a good deal of feeling with reference to that matter.,0,0.407,0.407
speech_00091,parnell_source_00346,1885,This will be a very sore and cruel winter for the agricultural community.,0.407,0,0.407
speech_00053,parnell_source_00283,1886,"But when I denounce outrage I denounce them in every part of Ireland, whether they occur in Ulster or in Kerry.",0.406,0,0.406
speech_00072,parnell_source_00306,1880,"Pull out that corner stone, break it up, destroy it, and you undermine English misgovernment.",0.406,0,0.406
speech_00072,parnell_source_00309,1880,"Pull out that corner stone, break it up, destroy it, and you undermine English misgovernment.",0.406,0,0.406
speech_00075,parnell_source_00325,1886,"I hope, Sir, that we may have a further opportunity of reverting to this matter.",0,0.406,0.406
speech_00084,parnell_source_00338,1880,Germany has abolished it in great part.,0,0.406,0.406
speech_00093,parnell_source_00348,1885,According to Mr. Forster it was these deplorable occurrences that made the sanction of boycotting.,0.406,0,0.406
speech_00052,parnell_source_00266,1886,"I did not accuse them of having sanctioned the execution of innocent men, knowing that they were innocent.",0.114,0.292,0.406
speech_00048,parnell_source_00232,1876,The hon. member went on amidst great interruptions to address the house.,0.161,0.244,0.405
speech_00048,parnell_source_00237,1876,"A remedy could be easily devised; but Mr. Parnell and his friends, before they can hope to effect any good, must forego the luxury of wasting fifty minutes after twelve o'clock in debating the desirability of adjournment.",0.071,0.334,0.405
"speech_00049, speech_00050",parnell_source_00241,1886,"The suppression of the revolt in Galway, and the acknowledgment of Mr. Parnell's authority as Home Rule dictator, has taken a weight of anxiety off the hearts of the Nationalists, and the parties are praised for their admirable spirit and the sublime spectacle of discipline and obedience to their trusted leader which has been exhibited.",0.134,0.271,0.405
speech_00053,parnell_source_00302,1886,"We, therefore, understand perfectly well that this Parliament has the ultimate supremacy and sovereignty.",0,0.405,0.405
speech_00072,parnell_source_00304,1880,"Hence, it only requires a partial failure of the crops to cause a famine.",0.405,0,0.405
speech_00077,parnell_source_00327,1886,"They found they were in danger, but why were they in danger?",0.405,0,0.405
speech_00004,parnell_source_00024,1875,"This much I can promise you   that I will faithfully abide by them, and that I will use your high trust to advance, to the best of my ability, the great cause of Self Government for Ireland.",0,0.404,0.404
speech_00025,parnell_source_00098,1875,"She would thereby purchase comparative safety for the future, and forgiveness for her cruel and felonious conduct to Ireland in the past .",0.242,0.162,0.404
speech_00025,parnell_source_00099,1875,"She would thereby purchase comparative safety for the future, and forgiveness for her cruel and felonious conduct to Ireland in the past .",0.242,0.162,0.404
speech_00029,parnell_source_00109,1875,"Abuse was a very poor argument and it was a very poor argument and it was a great pity there were no more Belfasts in this country, where Sir Michael Hicks Beach might be allowed to go about and give these lessons for it was lessons to them.",0.338,0.066,0.404
speech_00052,parnell_source_00266,1886,I may be told that the noble Lord has improved since then.,0,0.404,0.404
speech_00052,parnell_source_00274,1886,I may be told that the noble lord has improved since then.,0,0.404,0.404
speech_00065,parnell_source_00295,1880,"He trusted that the Government would not limit their contributions to the miserable grant of £45,000.",0.147,0.257,0.404
speech_00050,parnell_source_00250,1886,"It was a contest forced on under very peculiar circumstances, and under circumstances well calculated to try their devotion to the popular movement and to the interests of union .",0.082,0.321,0.403
speech_00052,parnell_source_00266,1886,I desire to speak very briefly.,0,0.403,0.403
speech_00052,parnell_source_00274,1886,I desire to speak very briefly.,0,0.403,0.403
speech_00053,parnell_source_00282,1886,That Parliament had many disadvantages.,0.403,0,0.403
speech_00053,parnell_source_00283,1886,GRATTAN'S PARLIAMENT HAD MANY DISADVANTAGES.,0.403,0,0.403
speech_00053,parnell_source_00303,1886,That Parliament had many disadvantages.,0.403,0,0.403
speech_00082,parnell_source_00336,1880,It is their own fault.,0.403,0,0.403
"speech_00049, speech_00050, speech_00051",parnell_source_00240,1886,"But you will defeat this dirty trick by giving such a vote in favour of O'Shea as will show that you have voted for me, and for principle, and for Ireland.",0.236,0.166,0.402
"speech_00049, speech_00050",parnell_source_00242,1886,"I admire the spirit and I appreciate the spirit with which he entered into this candidature, and I equally admire the spirit and the feelings and the temper he has exhibited in withdrawing his candidature.",0.067,0.335,0.402
speech_00072,parnell_source_00304,1880,"It is true you don’t have famines in the Blue Grass region of Kentucky, while we have famines on the rich plains in Ireland.",0.21,0.192,0.402
"speech_00087, speech_00088",parnell_source_00341,1880,"Revolutions are often very costly remedies, and a peaceful solution of the question would be better for landlord and tenant.",0.067,0.335,0.402
speech_00093,parnell_source_00348,1885,There can be no shadow of doubt about that.,0.402,0,0.402
speech_00017,parnell_source_00070,1875,A resolution was passed to the effect that it was unwise to pass upon political prisoners the same sentences that were imposed upon the ordinary class of prisoners indicted and convicted for criminal offences.,0.373,0.028,0.401
speech_00047,parnell_source_00200,1876,"With regard to the three prisoners who are now in prison in England, McCarthy is a brave soldier, who had fought, and fought well, for England in many parts of the world.",0.269,0.132,0.401
speech_00047,parnell_source_00222,1876,"With regard to the three prisoners who are now in prison in England, McCarthy is a brave soldier, who had fought, and fought well, for England in many parts of the world.",0.269,0.132,0.401
speech_00048,parnell_source_00232,1876,Although he raised his voice to a great pitch scarcely a single intelligible reached the gallery.,0,0.401,0.401
speech_00028,parnell_source_00104,1875,"You then deprived the meeting of your support, and left us to get along as best we could.",0.124,0.276,0.4
speech_00028,parnell_source_00106,1875,"You then deprived the meeting of your support, and left us to get along as best we could.",0.124,0.276,0.4
speech_00065,parnell_source_00295,1880,He was sure that his hon. Friend would be willing to agree to that Amendment.,0,0.4,0.4
speech_00085,parnell_source_00343,1880,"America cannot relieve the whole of Ireland; let us, then, devote our charitable efforts to these particularly afflicted districts.",0.196,0.204,0.4
speech_00091,parnell_source_00346,1885,"There is nothing in the world, humanly speaking, that could prevent their success save immoderation on their own part .",0.08,0.32,0.4
speech_00052,parnell_source_00277,1886,"But if they have a Constitution they will be proportionately careful not to lose it, and every violent speech and every criminal action will be so many nails in the coffin of that Constitution .",0.298,0.102,0.4
speech_00093,parnell_source_00348,1885,"They failed in proving that there was any increase in outrages, agrarian offences, although they unblushingly asserted that that there was.",0.318,0.081,0.399
speech_00052,parnell_source_00277,1886,"Englishmen love a man who fights his own corner out to the end, which Lord Spencer certainly did .",0.116,0.283,0.399
speech_00077,parnell_source_00327,1886,"These laws have always been abused, and they always will be abused.",0.398,0,0.398
speech_00083,parnell_source_00337,1880,Some cheered and others hissed him.,0,0.398,0.398
speech_00072,parnell_source_00305,1880,History shows that in such contests the tyrannical and oppressive minorities are invariably forced to the wall.,0.397,0,0.397
speech_00072,parnell_source_00306,1880,"Well, the Herald came out with a show of fairness.",0,0.397,0.397
speech_00084,parnell_source_00338,1880,"To a government that does not hesitate to spend ten or twenty millions a year in childish and cruel wars in all parts of the world, it would be surely a grand change if they would devote their attention to domestic affairs and to securing the happiness and prosperity of their own people at home instead of destroying that of other people abroad.",0.163,0.234,0.397
speech_00072,parnell_source_00306,1880,"In the best of seasons the people are not very far removed from starvation, hence, it only requires a partial failure of the crops to cause a famine.",0.282,0.115,0.397
speech_00076,parnell_source_00326,1886,"But I thank God, as a Protestant, that it is a very small minority.",0,0.396,0.396
speech_00004,parnell_source_00022,1875,"For several hours it was fed with tar barrels, casks, boxes, etc, the surrounding crowd cheering, joking, and enjoying themselves heartily.",0,0.395,0.395
speech_00052,parnell_source_00268,1886,"On the whole, however, apart from these defects, he believed the measure would be cheerfully accepted by the Irish people and their representatives as a satisfactory solution of the long standing dispute between the two countries, and tending to prosperity and peace in Ireland and satisfaction in England.",0.086,0.309,0.395
speech_00052,parnell_source_00269,1886,"I believe that so far from anything of the kind happening, that it contains a peaceful solution of difficulties between the two countries.",0.078,0.317,0.395
speech_00052,parnell_source_00274,1886,These cannot be weakened.,0,0.395,0.395
speech_00052,parnell_source_00280,1886,"On the whole, however, apart from these defects, he believed the measure would be cheerfully accepted by the Irish people and their representatives as a satisfactory solution of the long standing dispute between the two countries, and tending to prosperity and peace in Ireland and satisfaction in England.",0.086,0.309,0.395
speech_00050,parnell_source_00244,1886,"He has won the day, but he is not disinclined to conciliation on that account.",0.163,0.231,0.394
speech_00050,parnell_source_00254,1886,When moderation was necessary he had courage to show it.,0,0.394,0.394
speech_00052,parnell_source_00269,1886,But of this distant and unhappy time I have no thing to retract.,0.394,0,0.394
speech_00067,parnell_source_00297,1880,They knew that these small tenants had no saleable interest.,0.167,0.227,0.394
speech_00072,parnell_source_00304,1880,"But, thanks to your generous assistance, there has not been much loss of life from famine up to now, and although there has been a great deal of bitter and severe suffering, although many thousands of our people are daily becoming enfeebled through simple starvation, yet, I am happy to think that your help has saved the lives of many hundreds of persons, and your sympathy and the force of public opinion of this country have been of even more service than the money which you have sent so plentifully to Ireland,  for it has compelled the British Government to, at all events, pretend to do its duty in coming to the aid of the famished in Ireland.",0.19,0.204,0.394
speech_00072,parnell_source_00305,1880,The oppressive rents have exhausted the resources of the peasantry.,0.394,0,0.394
speech_00072,parnell_source_00305,1880,"But I do not wish you to take my word for it; take Froude, an unprejudiced witness, an historian of acknowledged ability and sincerity.",0.092,0.302,0.394
speech_00041,parnell_source_00180,1876,This reference to the traditional woes of Ireland drew forth protesting cries from the Ministerial side.,0.393,0,0.393
speech_00005,parnell_source_00017,1875,"He asked the House to regard Ireland as anxious to defend England when her hour of trial came; and he trusted the day might come when England might see that her strength lay in a truly independent, a truly free, and a truly self supporting Irish nation.",0.034,0.358,0.392
speech_00028,parnell_source_00104,1875,I attach no importance to the recollection of Mr. Keegan in the matter.,0.149,0.243,0.392
speech_00053,parnell_source_00302,1886,"But when I denounce outrages, I denounce them, sir, in all parts of Ireland , whether they occur in Ulster or in Kerry.",0.392,0,0.392
speech_00049,parnell_source_00238,1886,I wish to speak also of his demerits and the faults I have had to find with him.,0.263,0.127,0.39
"speech_00049, speech_00050, speech_00051",parnell_source_00240,1886,I have never led Ireland wrong.,0,0.39,0.39
speech_00052,parnell_source_00277,1886,I did not accuse them of having executed innocent men knowing they were innocent.,0,0.39,0.39
speech_00074,parnell_source_00324,1885,It would leave room for further agitation.,0.39,0,0.39
speech_00052,parnell_source_00266,1886,It complained of the execution and imprisonment of innocent men.,0.206,0.183,0.389
speech_00077,parnell_source_00327,1886,"Untold is the guilt of that man who, for party purposes, does not take advantage of the spirit that is abroad among the English to put together the hand of the Irish nation and that of England, to close the strife of centuries, a strife that has been of no good, no advantage, to the people of either country; a strife that has only been for the benefit of the money grabbing landlords ; a strife that has impeded popular progress in England as well as in Ireland, and that must continue to impede it; a strife which is fanned for the purpose of cheating you out of your right and to divert the energies of the newly enfranchised masses of Great Britain from the redress of their grievances, for the odious desire of oppressing and keeping down the small sister country.",0.223,0.166,0.389
speech_00049,parnell_source_00238,1886,Mr Lynch has acted honourably towards me and towards the party.,0,0.388,0.388
"speech_00049, speech_00050",parnell_source_00239,1886,Mr. Lynch has acted honourably towards me and towards the Party.,0,0.388,0.388
"speech_00049, speech_00050",parnell_source_00242,1886,Mr. Lynch has acted honourably towards me and towards the party.,0,0.388,0.388
"speech_00049, speech_00050",parnell_source_00249,1886,Mr Lynch has acted honourably towards me and towards the party.,0,0.388,0.388
speech_00050,parnell_source_00259,1886,Mr. Lynch has acted honourably towards me and towards the party.,0,0.388,0.388
speech_00052,parnell_source_00266,1886,"He has devoted his great mind, his extraordinary energy, to the unravelling of this question, and to the construction of this Bill.",0.085,0.303,0.388
speech_00052,parnell_source_00266,1886,"When you are proposing a great settlement a settlement which admittedly can only succeed if cheerfully accepted by public opinion in Ireland, and all its important provisions are recognized as just and equitable is it worth while for a rich country like England, on the question of £1,000,000 one way or the other, to drive too hard a bargain?",0.019,0.369,0.388
speech_00052,parnell_source_00274,1886,"He had devoted his great mind, his extraordinary energy, to the unravelling of this question, and to the construction of this Bill.",0.085,0.303,0.388
speech_00076,parnell_source_00326,1886,I am pleased that I have had the opportunity of coming among you.,0,0.388,0.388
"speech_00087, speech_00088",parnell_source_00341,1880,"There is great destitution, but it is not likely to reach the point of famine outside of these seven counties.",0.291,0.097,0.388
speech_00025,parnell_source_00098,1875,"Yesterday a great Home Rule meeting was held at Nobber, in Lower Meath.",0.135,0.252,0.387
speech_00049,parnell_source_00238,1886,"I admire and I appreciate the spirit with which he entered into this candidature, and I equally admire the spirit and the feelings and the temper he has exhibited in withdrawing his candidature.",0.072,0.315,0.387
"speech_00049, speech_00050",parnell_source_00239,1886,"I admire and appreciate the spirit with which he entered into this candidature, and I equally admire the spirit and the feelings and the temper he has exhibited in withdrawing his candidature.",0.072,0.315,0.387
speech_00052,parnell_source_00278,1886,"It would be cheerfully accepted by the Irish people and their representatives as a solution of the long standing dispute between the two countries, and would lead to the prosperity and peace of Ireland and the satisfaction of England.",0.053,0.334,0.387
speech_00053,parnell_source_00303,1886,"I am convinced there are a sufficient number of wise and just members in this House to cause it to disregard appeals made to passion, and to choose the better way of founding peace and good will among nations, and when the numbers in the division lobby come to be told, it will also be told, for the admiration of all future generations, that England and her Parliament, in this nineteenth century, was wise enough, brave enough, and generous enough to close the strife of centuries and to give peace and prosperity to suffering Ireland.",0.062,0.325,0.387
