speech_id,file,year,sentence,negative,positive,sum positive/negative
speech_00072,parnell_source_00305,1880,Well!,0,1,1
speech_00091,parnell_source_00346,1885,A CHALLENGE.,0,1,1
speech_00091,parnell_source_00346,1885,OUTRAGE .,1,0,1
speech_00093,parnell_source_00348,1885,No.,1,0,1
speech_00090,parnell_source_00345,1885,A STRONG IRISH PARTY.,0,0.857,0.857
speech_00090,parnell_source_00345,1885,ENGLAND'S FAILURE.,0.767,0,0.767
speech_00072,parnell_source_00306,1880,Help us then to kill this famine.,0.568,0.174,0.742
speech_00076,parnell_source_00326,1886,Well the Act failed.,0.446,0.284,0.73
speech_00052,parnell_source_00266,1886,"Oh, no!",0.714,0,0.714
speech_00076,parnell_source_00326,1886,Oh no!,0.714,0,0.714
speech_00050,parnell_source_00262,1886,Certainly not.,0,0.706,0.706
speech_00053,parnell_source_00282,1886,We understand this perfectly well.,0,0.703,0.703
speech_00053,parnell_source_00303,1886,We understand this perfectly well.,0,0.703,0.703
speech_00075,parnell_source_00325,1886,But I have no such apprehension.,0.698,0,0.698
speech_00053,parnell_source_00302,1886,I admit a desire and a strong sentiment in the matter.,0,0.69,0.69
speech_00053,parnell_source_00282,1886,"No, Sir.",0.688,0,0.688
speech_00053,parnell_source_00303,1886,"No, Sir.",0.688,0,0.688
speech_00073,parnell_source_00307,1885,That victory was a remarkable one.,0,0.688,0.688
speech_00093,parnell_source_00348,1885,You triumphed over and broke down coercion .,0.424,0.256,0.68
speech_00073,parnell_source_00331,1885,Let factions die!,0.677,0,0.677
speech_00053,parnell_source_00282,1886,"With great respect to the cries of ""No!""",0.178,0.493,0.671
speech_00072,parnell_source_00305,1880,"No landlords there, therefore no famines there.",0.664,0,0.664
speech_00022,parnell_source_00096,1875,What a fire in his eloquence!,0.276,0.379,0.655
"speech_00087, speech_00088",parnell_source_00341,1880,A peaceful solution should be offered.,0,0.647,0.647
speech_00076,parnell_source_00326,1886,Is that loyalty?,0,0.636,0.636
speech_00073,parnell_source_00310,1885,His victory was a very remarkable one.,0,0.633,0.633
speech_00073,parnell_source_00311,1885,My victory was a very remarkable one.,0,0.633,0.633
speech_00073,parnell_source_00330,1885,My victory was a very remarkable one.,0,0.633,0.633
speech_00073,parnell_source_00332,1885,His victory was a very remarkable one.,0,0.633,0.633
speech_00073,parnell_source_00329,1885,ENCOURAGE IRISH INDUSTRIES.,0,0.623,0.623
speech_00048,parnell_source_00232,1876,No doubt hon. gentlemen have enjoyed their dinner .,0.362,0.254,0.616
speech_00050,parnell_source_00261,1886,The meeting broke up with most uproarious Irish cheers.,0.181,0.431,0.612
speech_00083,parnell_source_00337,1880,The distress in Ireland is very great.,0.266,0.343,0.609
speech_00077,parnell_source_00327,1886,"But excitement and political passion arise, and under the influence of excitement an political passion no statesman, however eminent, is to be trusted to use exceptional laws.",0.058,0.549,0.607
speech_00052,parnell_source_00266,1886,"But there are, undoubtedly, great faults and blots in the measure.",0.328,0.278,0.606
speech_00052,parnell_source_00267,1886,But there are undoubtedly great faults and blots in the measure.,0.328,0.278,0.606
speech_00052,parnell_source_00269,1886,"But there are, undoubtedly, great faults and blots in the measure.",0.328,0.278,0.606
speech_00052,parnell_source_00270,1886,But there are undoubtedly great faults and blots in the measure.,0.328,0.278,0.606
speech_00052,parnell_source_00271,1886,"But there are, undoubtedly, great faults and blots in the measure.",0.328,0.278,0.606
speech_00052,parnell_source_00272,1886,But there are undoubtedly great faults and blots in the measure.,0.328,0.278,0.606
speech_00052,parnell_source_00274,1886,But there are undoubtedly great faults and blots in the measure.,0.328,0.278,0.606
speech_00052,parnell_source_00277,1886,But there are undoubtedly great faults and blots in the measure.,0.328,0.278,0.606
speech_00052,parnell_source_00278,1886,But there were undoubtedly great faults and blots in the measure.,0.328,0.278,0.606
speech_00052,parnell_source_00281,1886,But there are undoubtedly great faults and blots in the measure.,0.328,0.278,0.606
speech_00091,parnell_source_00346,1885,"The outlook in all other respects is hopeful for Ireland; but undoubtedly the great depression of prices, the agricultural depression, introduces a new and very great difficulty.",0.285,0.316,0.601
speech_00090,parnell_source_00345,1885,NO MORE AND NO LESS.,0.595,0,0.595
speech_00050,parnell_source_00262,1886,"The Tories are capable of playing a ""dirty trick.""",0.236,0.358,0.594
speech_00053,parnell_source_00282,1886,There is another and a stronger argument as well.,0.205,0.385,0.59
speech_00053,parnell_source_00303,1886,There is another and stronger argument as well.,0.205,0.385,0.59
speech_00005,parnell_source_00025,1875,Mr Parnell acquitted him admirably displaying no ordinary ability as a debater.,0.129,0.459,0.588
speech_00076,parnell_source_00326,1886,But I have no fear of such a result.,0.587,0,0.587
speech_00050,parnell_source_00263,1886,Magnanimous Mr. Lynch!,0,0.583,0.583
speech_00029,parnell_source_00107,1875,Sir Michael Hicks Beach thereby admitted a great weakness somewhere.,0.196,0.385,0.581
speech_00029,parnell_source_00110,1875,Sir Michael Hicks Beach thereby admitted a great weakness somewhere.,0.196,0.385,0.581
speech_00073,parnell_source_00318,1885,His victory there was a very remarkable one.,0,0.58,0.58
speech_00072,parnell_source_00309,1880,Justice and the many against injustice and the few must win.,0.196,0.381,0.577
speech_00028,parnell_source_00104,1875,Mr. Keegan   Yes.,0,0.574,0.574
speech_00028,parnell_source_00106,1875,Mr. Keegan   Yes .,0,0.574,0.574
speech_00028,parnell_source_00106,1875,Mr. Keegan   Yes .,0,0.574,0.574
speech_00069,parnell_source_00299,1880,But in military prisons in Ireland the prisoners could be flogged for breaches of prison discipline.,0.574,0,0.574
speech_00090,parnell_source_00345,1885,THE GREEN EYED MONSTER.,0.571,0,0.571
speech_00053,parnell_source_00282,1886,Theirs is not the shame and disgrace of this fear.,0.412,0.157,0.569
speech_00053,parnell_source_00303,1886,Theirs is not the shame and disgrace of this fear.,0.412,0.157,0.569
speech_00004,parnell_source_00024,1875,I know that no personal merit of mine has obtained for me this great triumph.,0.096,0.469,0.565
speech_00067,parnell_source_00297,1880,"No great cause was ever won without suffering, and the Irish people, if they were determined to obtain a satisfactory solution of the Land Question, must be ready to suffer.",0.125,0.438,0.563
speech_00056,parnell_source_00286,1880,This was a course that worked a special injustice.,0.325,0.237,0.562
speech_00053,parnell_source_00302,1886,There is another argument stronger still.,0.275,0.286,0.561
speech_00065,parnell_source_00295,1880,The great demand for fresh seed caused an increase in the price.,0.082,0.478,0.56
speech_00091,parnell_source_00346,1885,"They had gone through in these five years, suffering, danger, doubt, and uncertainty.",0.559,0,0.559
speech_00053,parnell_source_00283,1886,Theirs is not the shame and disgrace of those fears.,0.397,0.161,0.558
speech_00079,parnell_source_00333,1880,Again I thank you.,0,0.556,0.556
speech_00090,parnell_source_00345,1885,THE GREATER IRELAND.,0,0.556,0.556
speech_00052,parnell_source_00274,1886,The Conservative party has always been most remarkable for its wisdom.,0,0.555,0.555
speech_00004,parnell_source_00023,1875,"In the evil days of corruption, which destroyed the Independence of Ireland, he lost a great office, and refused a Peerage to oppose the fatal measure of Union.",0.453,0.097,0.55
speech_00074,parnell_source_00324,1885,"Many persons were arrested, received the mockery of a trial, and were condemned to death.",0.55,0,0.55
speech_00065,parnell_source_00295,1880,As a measure for the relief of distress it was equally miserable.,0.373,0.175,0.548
speech_00078,parnell_source_00328,1885,He wished to notice a very infamous falsehood.,0.548,0,0.548
speech_00023,parnell_source_00084,1875,This magnificent meeting will strengthen his purpose and cheer his heart   it fills mine with joy and pride.,0,0.547,0.547
speech_00082,parnell_source_00336,1880,"""Disturbances are over.",0.545,0,0.545
speech_00053,parnell_source_00302,1886,The right hon gentleman himself is certainly free from reproach in respect of this matter.,0.091,0.452,0.543
speech_00072,parnell_source_00305,1880,"Help us to prevent the famine, and we promise you it will be the last famine.",0.29,0.253,0.543
speech_00086,parnell_source_00340,1880,There is distress and destruction all over Ireland.,0.542,0,0.542
speech_00052,parnell_source_00272,1886,Englishmen love a man who fights his own corner .,0.209,0.326,0.535
speech_00073,parnell_source_00308,1885,Mr. Parnell   My victory was a very remarkable one .,0,0.535,0.535
speech_00073,parnell_source_00313,1885,Mr Parnell   My victory was a very remarkable one.,0,0.535,0.535
speech_00073,parnell_source_00314,1885,Mr Parnell   My victory was a very remarkable one .,0,0.535,0.535
speech_00073,parnell_source_00323,1885,Mr. Parnell: My victory was a very remarkable one.,0,0.535,0.535
"speech_00049, speech_00050, speech_00051",parnell_source_00240,1886,I do not wish to detain you.,0.263,0.271,0.534
speech_00084,parnell_source_00338,1880,I am confident that we have your sympathy.,0,0.533,0.533
speech_00080,parnell_source_00334,1880,I am proud to represent a county like Meath.,0,0.528,0.528
speech_00053,parnell_source_00283,1886,But there is another and a stronger argument still.,0.257,0.269,0.526
speech_00053,parnell_source_00282,1886,I join the right hon. Gentleman in expressing my contempt for these cowardly and disgraceful practices.,0.429,0.095,0.524
speech_00053,parnell_source_00283,1886,The right hon. gentleman himself is certainly free from reproach.,0.136,0.388,0.524
speech_00053,parnell_source_00303,1886,I join the right hon. gentleman in expressing my contempt for these cowardly and disgraceful practices.,0.429,0.095,0.524
speech_00084,parnell_source_00338,1880,It is pretending to show interest.,0,0.524,0.524
speech_00050,parnell_source_00261,1886,"Healy, Biggar, Lynch and others without impairing the usefulness of the mutineers for active duty, perfect peace by no means reigns among the Galway electors.",0.202,0.319,0.521
speech_00053,parnell_source_00282,1886,"For instance, the great wealth of Ulster has been taken up as the war cry of the Loyal and Patriotic Union.",0.21,0.311,0.521
speech_00053,parnell_source_00303,1886,"For instance, the great wealth of Ulster has been taken up as the war cry of the Loyal and Patriotic Union.",0.21,0.311,0.521
speech_00050,parnell_source_00261,1886,Although Mr. Parnell scored a masterful success in suppressing the mutiny of Messrs.,0.321,0.198,0.519
speech_00056,parnell_source_00286,1880,for the same strength.,0,0.516,0.516
speech_00082,parnell_source_00336,1880,The people have triumphed.,0,0.516,0.516
speech_00093,parnell_source_00348,1885,There was a great conspiracy   another conspiracy   raised amongst the English newspapers to exaggerate the amount of crime in this country.,0.384,0.132,0.516
speech_00025,parnell_source_00097,1875,"He spoke strongly in favour of amnesty for the political prisoners, whose sufferings in English prisons de described.",0.328,0.187,0.515
speech_00053,parnell_source_00302,1886,"It would be most mischievous and dangerous, and sure to prevent such a settlement.",0.332,0.183,0.515
speech_00025,parnell_source_00098,1875,Nobody doubted that .,0.512,0,0.512
speech_00025,parnell_source_00099,1875,Nobody doubted that .,0.512,0,0.512
speech_00073,parnell_source_00315,1885,You accepted them.,0,0.512,0.512
speech_00081,parnell_source_00335,1880,"No physical violence, no unconstitutional action was contemplated, or was, in his judgment, necessary.",0.512,0,0.512
speech_00086,parnell_source_00340,1880,"It is a remarkable fact that no other country in Europe, save where British rule extends, does the feudal system fully prevail.",0.131,0.379,0.51
speech_00052,parnell_source_00267,1886,"He has devoted his great mind, his extraordinary energy to the unravelling of this question.",0.112,0.397,0.509
speech_00052,parnell_source_00269,1886,"He has devoted his great mind, his extraordinary energy, to the unravelling of this question.",0.112,0.397,0.509
speech_00052,parnell_source_00270,1886,"He has devoted his great mind, his extraordinary energy to the unravelling of this question.",0.112,0.397,0.509
speech_00052,parnell_source_00271,1886,"He has devoted his great mind, his extraordinary energy to the unravelling of this question.",0.112,0.397,0.509
speech_00052,parnell_source_00272,1886,"He has devoted his great mind, his extraordinary energy, to the unravelling of this question.",0.112,0.397,0.509
speech_00052,parnell_source_00281,1886,"He has devoted his great mind, his extraordinary energy, to the unravelling of this question.",0.112,0.397,0.509
speech_00078,parnell_source_00328,1885,Mr. Gladstone could avoid all this trouble by simply bringing his great intellect to the promoting of a constitutional course.,0.172,0.337,0.509
"speech_00049, speech_00050, speech_00051",parnell_source_00240,1886,Three cheers for O'Shea .,0,0.508,0.508
"speech_00087, speech_00088",parnell_source_00341,1880,... The Great Leader's Speech.,0,0.506,0.506
speech_00089,parnell_source_00344,1880,"These announcements were simply shame, because they knew perfectly well that the proposition of relief would not be accepted.",0.174,0.332,0.506
speech_00090,parnell_source_00345,1885,A great contention them took place.,0,0.506,0.506
speech_00053,parnell_source_00282,1886,I admit that it is an honest one.,0,0.505,0.505
speech_00053,parnell_source_00303,1886,I admit that it is an honest one.,0,0.505,0.505
speech_00053,parnell_source_00302,1886,I join the right hon gentleman in the expression of contempt for those cowardly and disgraceful practices .,0.411,0.091,0.502
speech_00086,parnell_source_00340,1880,We think you ought to be proud of the opportunity given you to save a noble people.,0,0.502,0.502
speech_00020,parnell_source_00078,1875,He requested his belief that that party was dead .,0.307,0.193,0.5
"speech_00049, speech_00050, speech_00051",parnell_source_00240,1886,A Voice   You are welcome.,0,0.5,0.5
speech_00073,parnell_source_00315,1885,"We shall struggle, as we have been struggling, for the great and important interests of the tenant farmer.",0.196,0.304,0.5
speech_00076,parnell_source_00326,1886,Their loyalty that they boast of is loyalty to their own pockets.,0.111,0.389,0.5
speech_00086,parnell_source_00340,1880,On this great principle the government must stand condemned.,0.207,0.293,0.5
speech_00004,parnell_source_00022,1875,"The Tory hoped to win by a division of the National strength, but the people of Meath, by their union, disappointed him, and achieved a magnificent victory for the cause of Ireland.",0.091,0.407,0.498
speech_00053,parnell_source_00282,1886,"But, Sir, I refuse to believe that these evil days must come.",0.497,0,0.497
speech_00056,parnell_source_00287,1880,Everyone must wish to avoid inflicting unnecessary expense upon the ratepayers of Ireland.,0.346,0.151,0.497
speech_00053,parnell_source_00302,1886,"But, sir, I refuse to believe that those evil days must come.",0.497,0,0.497
speech_00053,parnell_source_00303,1886,"But, Sir, I refuse to believe that these evil days must come.",0.497,0,0.497
speech_00005,parnell_source_00019,1875,But other reasons have been given for this wonderful patchwork Peace Preservation Bill.,0,0.496,0.496
speech_00004,parnell_source_00024,1875,"I remain, Gratefully and faithfully yours, Charles Stewart Parnell.",0,0.496,0.496
speech_00005,parnell_source_00027,1875,But other reasons have been given for this wonderful patchwork Peace Preservation Bill .,0,0.496,0.496
speech_00005,parnell_source_00028,1875,But other reasons have been given for this wonderful patchwork Peace Preservation Bill .,0,0.496,0.496
speech_00093,parnell_source_00348,1885,I welcome him  as one of the strongest supporters that Providence has ever vouchsafed to your cause .,0,0.496,0.496
speech_00053,parnell_source_00283,1886,"But, sir, I refuse to believe that those evils will come.",0.495,0,0.495
speech_00053,parnell_source_00282,1886,The right hon. Gentleman himself is certainly free from reproach in this matter.,0.112,0.382,0.494
speech_00053,parnell_source_00283,1886,"We want the energy, the patriotism, the talent, and the work of every Irishman      to ensure that this great experiment should be a success.",0,0.494,0.494
speech_00053,parnell_source_00303,1886,The right hon. gentleman himself is certainly free from reproach in this matter.,0.112,0.382,0.494
speech_00075,parnell_source_00325,1886,He was both inaccurate and vague.,0.494,0,0.494
speech_00085,parnell_source_00343,1880,"I am confident, said he, that the suffering people will receive your sympathy.",0.174,0.32,0.494
speech_00049,parnell_source_00238,1886,It is a very remarkable fact.,0,0.493,0.493
"speech_00049, speech_00050",parnell_source_00242,1886,It is a very remarkable fact.,0,0.493,0.493
"speech_00049, speech_00050",parnell_source_00249,1886,It is a very remarkable fact.,0,0.493,0.493
speech_00093,parnell_source_00348,1885,"A Voice   Three cheers for Parnell, and success to Davitt .",0,0.493,0.493
speech_00047,parnell_source_00225,1876,He had better not.,0,0.492,0.492
speech_00050,parnell_source_00246,1886,Captain O'Shea's return would be no injury to the Irish party.,0.318,0.172,0.49
speech_00050,parnell_source_00253,1886,Captain O'Shea's return would be no injury to the Irish party.,0.318,0.172,0.49
speech_00050,parnell_source_00260,1886,Captain O'Shea's return would be no injury to the Irish party.,0.318,0.172,0.49
speech_00065,parnell_source_00295,1880,"£45,000 was a poor contribution out of the Exchequer for the relief of distress.",0.332,0.158,0.49
speech_00065,parnell_source_00295,1880,"It would not ruin England to give a grant of that kind, and the advantage and benefit of it to the poor fishermen on the Western Coast of Ireland would render them perfectly satisfied.",0.063,0.427,0.49
speech_00041,parnell_source_00162,1876,Mr. Parnell refused to accept this suggestion.,0.224,0.265,0.489
speech_00078,parnell_source_00349,1885,"the enemy's camp , and we are confident that he will wage a most successful war too .",0.178,0.311,0.489
speech_00072,parnell_source_00305,1880,I should like to speak kindly of this enterprise.,0,0.487,0.487
speech_00093,parnell_source_00348,1885,"And the sanctions of the boycotting, according to him, were the outrages, very lamentable and very deplorable outrages, which I am glad to say have disappeared from out midst   moonlighting and maiming of cattle in some instances, and the shooting of obnoxious individuals in others.",0.44,0.047,0.487
speech_00050,parnell_source_00262,1886,He has no personal ambition to serve.,0.227,0.258,0.485
speech_00052,parnell_source_00269,1886,Lord Spencer certainly fought his own corner .,0.237,0.247,0.484
speech_00052,parnell_source_00271,1886,Lord Spencer certainly fought his own corner.,0.237,0.247,0.484
speech_00052,parnell_source_00281,1886,Lord Spencer certainly fought his own corner.,0.237,0.247,0.484
speech_00076,parnell_source_00326,1886,The great majority of them   and I know them well   are pretty much indifferent upon this question.,0.078,0.405,0.483
speech_00073,parnell_source_00329,1885,THE TRUE PARLIAMENTARY POLICY.,0,0.483,0.483
speech_00081,parnell_source_00335,1880,"Then, I believe, that one great step toward the freedom of Ireland will have been accomplished.",0,0.483,0.483
speech_00086,parnell_source_00340,1880,"They had just come out of a disastrous war, without revenue or resources of any kind.",0.336,0.147,0.483
speech_00052,parnell_source_00267,1886,I quite agree with that.,0,0.482,0.482
speech_00052,parnell_source_00270,1886,I quite agree with that.,0,0.482,0.482
speech_00052,parnell_source_00271,1886,I quite agree with that.,0,0.482,0.482
speech_00052,parnell_source_00272,1886,I quite agree with that.,0,0.482,0.482
speech_00052,parnell_source_00281,1886,I quite agree with that.,0,0.482,0.482
speech_00072,parnell_source_00306,1880,"Such a pretense, such a monstrous fraud and hypocrisy would be possible in no place but in Ireland.",0.482,0,0.482
speech_00073,parnell_source_00308,1885,"We shall struggle, as we have been struggling, for the great and important interests of the Irish tenant farmer.",0.189,0.293,0.482
speech_00073,parnell_source_00311,1885,"We shall struggle, as we have been struggling for the great and important interests of the Irish tenant farmer.",0.189,0.293,0.482
speech_00073,parnell_source_00313,1885,We shall struggle as we have been struggling for the great and important interests of the Irish tenant farmer.,0.189,0.293,0.482
speech_00073,parnell_source_00314,1885,"We shall struggle as we have been struggling, for the great and important interests of the Irish tenant farmer.",0.189,0.293,0.482
speech_00074,parnell_source_00324,1885,"There will be a difficult and a tedious battle before us, but with pluck, energy, and determination I believe that it is just possible to win it.",0.153,0.329,0.482
speech_00073,parnell_source_00330,1885,"We shall struggle, as we have been struggling, for the great and important interests of the Irish tenant farmer.",0.189,0.293,0.482
speech_00053,parnell_source_00282,1886,But certainly I do condemn these outrages in Kerry; and the right hon. Gentleman says very rightly that they must be put a stop to.,0.307,0.174,0.481
speech_00053,parnell_source_00303,1886,"But certainly I do condemn these outrages in Kerry, and the right hon. gentleman says very rightly that they must be put a stop to.",0.307,0.174,0.481
speech_00086,parnell_source_00340,1880,Would emigration cure the evils?,0.481,0,0.481
speech_00022,parnell_source_00096,1875,Mr. C. S. Parnell What a fine pleasing countenance!,0,0.478,0.478
speech_00050,parnell_source_00263,1886,"The violent Healy and the cynical Biggar were in open rebellion against the dictatorship of ""Charlie.""",0.478,0,0.478
speech_00074,parnell_source_00324,1885,"For some two years, under the first Coercion Act, no man's liberty in Ireland was safe.",0.204,0.274,0.478
speech_00075,parnell_source_00325,1886,"Well, Sir, the situation is undoubtedly a serious one; but if the Government step in and support that small minority of landlords who are refusing all reasonable concessions to their tenants, like that which I have cited, the result will be that these landowners and many others will be strengthened in their unjust demands, and great suffering and misery would befall the unfortunate and wretched people.",0.27,0.207,0.477
speech_00076,parnell_source_00326,1886,I agree with my friend that the terms would have been too favourable.,0,0.477,0.477
speech_00049,parnell_source_00238,1886,"A crisis of some gravity, difficulty, and danger then arose, but, as I have told you, that crisis has happily terminated by the patriotic withdrawal of Mr Lynch.",0.317,0.159,0.476
speech_00086,parnell_source_00340,1880,"Gladstone attempted, but not until a prison had been attacked at Clerkenwell, and the tragedy had occurred in Manchester.",0.352,0.124,0.476
speech_00053,parnell_source_00283,1886,But if abuses do take place the Imperial Parliament may intervene in cases of grave emergency.,0.474,0,0.474
speech_00067,parnell_source_00297,1880,"Well, he was perfectly willing to face that contingency.",0,0.474,0.474
speech_00073,parnell_source_00308,1885,Another Voice   And you killed Whiggery .,0.474,0,0.474
speech_00073,parnell_source_00313,1885,"Another voice   ""And you killed Whiggery.""",0.474,0,0.474
speech_00073,parnell_source_00314,1885,Another Voice   And you killed Whiggery .,0.474,0,0.474
speech_00052,parnell_source_00267,1886,But I noticed the somewhat discouraging fact that his own valuable eucomiums of his plan elicited no enthusiasm of any kind from any section of the house .,0.156,0.316,0.472
speech_00052,parnell_source_00269,1886,But I notice the somewhat discouraging fact that his own valuable encomiums of his plan elicited no enthusiasm of any kind from any section of the House .,0.156,0.316,0.472
speech_00052,parnell_source_00271,1886,But I noticed the somewhat discouraging fact that his own valuable encomiums of his plan elicited no enthusiasm of any kind from any section of the House.,0.156,0.316,0.472
speech_00052,parnell_source_00272,1886,But I noticed the somewhat discouraging fact that his own valuable encomiums of his plan elicited no enthusiasm of any kind from any section of the House .,0.156,0.316,0.472
speech_00041,parnell_source_00182,1876,"I believe there is great wisdom at times in reserving one's strength; but when the necessity of a hostile declaration is clear, it ought to be made, and maintained, regardless of threat or cajolery.",0.254,0.217,0.471
speech_00041,parnell_source_00166,1876,"The debate was, therefore, adjourned sine die  amid some laughter.",0.258,0.212,0.47
speech_00070,parnell_source_00300,1880,He did not wish to detain the Committee at greater length.,0.15,0.32,0.47
speech_00078,parnell_source_00328,1885,Therefore Mr. Gladstone showed a true and a keen appreciation of the importance of the question when he impressed it upon his hearers.,0,0.47,0.47
speech_00085,parnell_source_00339,1880,"First, to contend against the present great calamity and send assistance to a quarter of a million of starving countrymen.",0.266,0.202,0.468
speech_00056,parnell_source_00286,1880,"In Ireland there were no important manufactures, and so it amounted to this, that rich, prosperous England was benefited at the expense of impoverished Ireland.",0.16,0.308,0.468
